{
  "$schema": "../schemas/event-card.schema.json",
  "id": "agentic_incident",
  "title": "strings:event.agenticIncident.title",
  "body": "strings:event.agenticIncident.body",
  "trigger": { "era": "late", "turnMin": 10, "turnMax": 15, "weight": 3 },
  "choices": [
    {
      "label": "strings:event.agenticIncident.audit",
      "effects": {
        "capability": -50,
        "politicalCapital": -50,
        "safetyInsight": 100,
        "publicTrust": 50
      },
      "delayedEffects": [{ "inTurns": 2, "effects": { "capital": -100 } }]
    },
    {
      "label": "strings:event.agenticIncident.contain",
      "effects": {
        "publicTrust": -50,
        "hidden.agencyErosion": 50,
        "flags": ["incidentDismissed"]
      },
      "delayedEffects": [
        { "inTurns": 3, "effects": { "society.unrest": 100, "publicTrust": -100 } }
      ]
    }
  ],
  "sourceIds": ["SRC-AGENTIC-MISALIGNMENT", "SRC-SCHEMING"],
  "tags": ["agents", "incident", "oversight"]
}
