{
  "$schema": "../schemas/event-card.schema.json",
  "id": "model_weight_theft",
  "title": "strings:event.modelWeightTheft.title",
  "body": "strings:event.modelWeightTheft.body",
  "trigger": { "era": "mid", "turnMin": 6, "turnMax": 11, "weight": 3 },
  "choices": [
    {
      "label": "strings:event.modelWeightTheft.attribute",
      "effects": {
        "rival.capability": 100,
        "rival.trust": -150,
        "politicalCapital": -50,
        "flags": ["weightsStolen"]
      },
      "delayedEffects": [{ "inTurns": 2, "effects": { "rival.capability": 50 } }]
    },
    {
      "label": "strings:event.modelWeightTheft.harden",
      "effects": {
        "rival.capability": 100,
        "capital": -100,
        "safetyInsight": 50,
        "flags": ["weightsStolen"]
      }
    }
  ],
  "sourceIds": ["SRC-RAND-WEIGHTS"],
  "tags": ["security", "espionage", "china"]
}
