{
  "$schema": "../schemas/event-card.schema.json",
  "id": "viral_job_loss",
  "title": "strings:event.viralJobLoss.title",
  "body": "strings:event.viralJobLoss.body",
  "trigger": { "era": "early", "turnMin": 1, "turnMax": 5, "weight": 3 },
  "choices": [
    {
      "label": "strings:event.viralJobLoss.retrain",
      "effects": { "capital": -100, "publicTrust": 50, "society.unrest": -50 },
      "delayedEffects": [{ "inTurns": 4, "effects": { "publicTrust": 50 } }]
    },
    {
      "label": "strings:event.viralJobLoss.dismiss",
      "effects": { "politicalCapital": 50 },
      "delayedEffects": [
        { "inTurns": 2, "effects": { "publicTrust": -100, "society.unrest": 100 } }
      ]
    }
  ],
  "sourceIds": ["SRC-IMF-GENAI", "SRC-ANTHROPIC-ECON-INDEX"],
  "tags": ["labor", "society", "media"]
}
