{
  "$schema": "../schemas/event-card.schema.json",
  "id": "grid_strain",
  "title": "strings:event.gridStrain.title",
  "body": "strings:event.gridStrain.body",
  "trigger": { "era": "early", "turnMin": 2, "turnMax": 8, "weight": 3 },
  "choices": [
    {
      "label": "strings:event.gridStrain.priority",
      "effects": {
        "publicTrust": -100,
        "society.unrest": 50,
        "flags": ["gridPriority"]
      },
      "delayedEffects": [{ "inTurns": 2, "effects": { "society.unrest": 50 } }]
    },
    {
      "label": "strings:event.gridStrain.throttle",
      "effects": { "capability": -50, "publicTrust": 50 },
      "delayedEffects": [{ "inTurns": 2, "effects": { "energy": 50 } }]
    }
  ],
  "sourceIds": ["SRC-IEA-ENERGY-AI", "SRC-GRID-DATACENTER"],
  "tags": ["energy", "infrastructure", "society"]
}
