{
  "$schema": "../schemas/event-card.schema.json",
  "id": "chip_smuggling",
  "title": "strings:event.chipSmuggling.title",
  "body": "strings:event.chipSmuggling.body",
  "trigger": {
    "era": "mid",
    "turnMin": 5,
    "turnMax": 11,
    "weight": 2,
    "conditions": { "flagsAll": ["exportCrackdown"] }
  },
  "choices": [
    {
      "label": "strings:event.chipSmuggling.enforce",
      "effects": { "capital": -100, "politicalCapital": -50 },
      "delayedEffects": [{ "inTurns": 2, "effects": { "rival.capability": -50 } }]
    },
    {
      "label": "strings:event.chipSmuggling.lookAway",
      "effects": { "rival.capability": 100, "capital": 50 },
      "delayedEffects": [{ "inTurns": 3, "effects": { "politicalCapital": -100 } }]
    }
  ],
  "sourceIds": ["SRC-CNAS-SMUGGLING", "SRC-CSIS-EXPORT"],
  "tags": ["chips", "enforcement", "chokepoint"]
}
